{"type":"config","name":"Reduce Forge workspace-service memory","metricName":"peak_rss_mb","metricUnit":"mb","bestDirection":"lower"}
{"run":1,"commit":"3942cf6","metric":212.52,"metrics":{},"status":"keep","description":"baseline: add synthetic workspace-sync memory benchmark harness","timestamp":1773511446490,"segment":0}
{"run":2,"commit":"0a631f3","metric":70.03,"metrics":{},"status":"keep","description":"split workspace sync/status into hash-only planning plus selective rereads","timestamp":1773511759522,"segment":0}
{"run":3,"commit":"a2e5f05","metric":28.95,"metrics":{},"status":"keep","description":"cap workspace file-read concurrency to bound sync/status memory","timestamp":1773511934728,"segment":0}
{"run":4,"commit":"c231fad","metric":19.16,"metrics":{},"status":"keep","description":"lower workspace sync/status read cap from 16 to 8","timestamp":1773511999085,"segment":0}
{"run":5,"commit":"69bde2c","metric":14.7,"metrics":{},"status":"keep","description":"lower workspace sync/status read cap from 8 to 4","timestamp":1773512072641,"segment":0}
{"run":6,"commit":"64bff0c","metric":11.58,"metrics":{},"status":"keep","description":"lower workspace sync/status read cap from 4 to 2","timestamp":1773512129528,"segment":0}
{"run":7,"commit":"64bff0c","metric":13.06,"metrics":{},"status":"discard","description":"try a single-file workspace read cap","timestamp":1773512170989,"segment":0}
{"run":8,"commit":"72c6f71","metric":11.55,"metrics":{},"status":"keep","description":"switch workspace hash/upload passes to sequential reads","timestamp":1773512339712,"segment":0}
{"run":9,"commit":"fb4e5ec","metric":11.39,"metrics":{},"status":"keep","description":"stream sync/status comparison directly against remote hash maps","timestamp":1773513909017,"segment":0}
{"run":10,"commit":"fb4e5ec","metric":11.8,"metrics":{},"status":"discard","description":"trim git path-discovery allocations by skipping file_name and extra filter vectors","timestamp":1773514006785,"segment":0}
{"run":11,"commit":"fb4e5ec","metric":12.22,"metrics":{},"status":"discard","description":"replace remote hash maps with sorted merge-join planning for sync and status","timestamp":1773514182854,"segment":0}
{"run":12,"commit":"6cd8532","metric":11.25,"metrics":{},"status":"keep","description":"switch remote hash planning from BTreeMap to HashMap plus final key sorting","timestamp":1773514272499,"segment":0}
{"run":13,"commit":"6cd8532","metric":11.25,"metrics":{},"status":"discard","description":"hash local files from raw bytes with UTF-8 validation to avoid read_to_string allocations","timestamp":1773514387441,"segment":0}
{"run":14,"commit":"6f537b2","metric":11.17,"metrics":{},"status":"keep","description":"compare sync/status paths in workspace-relative form and absolutize only outputs","timestamp":1773514594240,"segment":0}
{"run":15,"commit":"6f537b2","metric":12.27,"metrics":{},"status":"discard","description":"decode remote SHA-256 hex strings to 32-byte arrays during sync/status planning","timestamp":1773514796018,"segment":0}
{"run":16,"commit":"db0c88f","metric":11.16,"metrics":{},"status":"keep","description":"drop unused git ls-files basename allocations during workspace discovery","timestamp":1773514863360,"segment":0}
{"run":17,"commit":"db0c88f","metric":13.11,"metrics":{},"status":"discard","description":"replace WalkedFile discovery buffers with direct PathBuf path lists","timestamp":1773514977506,"segment":0}
{"run":18,"commit":"db0c88f","metric":11.75,"metrics":{},"status":"discard","description":"shrink remote hash maps before sync/status comparison","timestamp":1773515043789,"segment":0}
{"run":19,"commit":"db0c88f","metric":12.77,"metrics":{},"status":"discard","description":"store remote sync/status hash maps as boxed strings to trim String headers","timestamp":1773515163402,"segment":0}
{"run":20,"commit":"db0c88f","metric":11.17,"metrics":{},"status":"discard","description":"reuse remote hash strings from the fetched vector via path-to-index maps","timestamp":1773515490198,"segment":0}
{"run":21,"commit":"bb2cb37","metric":11.09,"metrics":{},"status":"keep","description":"short-circuit already-in-sync workspace syncs before empty delete/upload setup","timestamp":1773515712537,"segment":0}
{"run":22,"commit":"bb2cb37","metric":11.09,"metrics":{},"status":"discard","description":"store discovered sync/status paths as relative strings instead of PathBuf values","timestamp":1773515826099,"segment":0}
{"run":23,"commit":"bb2cb37","metric":11.34,"metrics":{},"status":"discard","description":"add a streaming UTF-8 hash API for hash-only workspace reads","timestamp":1773516155085,"segment":0}
{"run":24,"commit":"1d0ff57","metric":10.64,"metrics":{},"status":"keep","description":"remove redundant workspace path canonicalization in sync initialization","timestamp":1773516368469,"segment":0}
{"run":25,"commit":"1d0ff57","metric":11.22,"metrics":{},"status":"discard","description":"reuse the already-fetched auth token during workspace init on the sync hot path","timestamp":1773516446869,"segment":0}
{"run":26,"commit":"1d0ff57","metric":11.16,"metrics":{},"status":"discard","description":"skip the zero-op Syncing progress event on already-in-sync workspaces","timestamp":1773516511075,"segment":0}
{"run":27,"commit":"1d0ff57","metric":11.08,"metrics":{},"status":"discard","description":"stream git ls-files output directly into hash comparison on the hot sync path","timestamp":1773516698796,"segment":0}
{"run":28,"commit":"1d0ff57","metric":12.7,"metrics":{},"status":"discard","description":"avoid per-workspace PathBuf allocation during ancestor workspace matching","timestamp":1773516763749,"segment":0}
{"run":29,"commit":"1d0ff57","metric":12.16,"metrics":{},"status":"discard","description":"mock git ls-files in the synthetic memory harness to remove subprocess overhead","timestamp":1773546239137,"segment":0}
{"run":30,"commit":"91496c5","metric":11.05,"metrics":{},"status":"discard","description":"reuse owned relative paths during remote-hash normalization and local hash emission","timestamp":1773546455464,"segment":0}
{"run":31,"commit":"4fa56c5","metric":12.12,"metrics":{},"status":"discard","description":"specialize git and walker discovery to return filtered path lists directly","timestamp":1773546686398,"segment":0}
{"run":32,"commit":"4fa56c5","metric":12.19,"metrics":{},"status":"discard","description":"manually hex-encode SHA-256 digests to avoid formatter overhead in compute_hash","timestamp":1773546792141,"segment":0}
{"run":33,"commit":"4fa56c5","metric":13.27,"metrics":{},"status":"discard","description":"reuse a mutable absolute-path buffer across sequential hash reads","timestamp":1773546866417,"segment":0}
{"run":34,"commit":"4fa56c5","metric":11.05,"metrics":{},"status":"discard","description":"avoid allocating lowercase extension strings for already-lowercase path filtering","timestamp":1773546933950,"segment":0}
{"run":35,"commit":"4fa56c5","metric":12.22,"metrics":{},"status":"discard","description":"drop hash-pass file contents before yielding each streamed FileHash","timestamp":1773546996766,"segment":0}
{"type":"config","name":"Fix flow-nexus MCP array schemas for OpenAI Responses compatibility","metricName":"valid_schema_checks","metricUnit":"","bestDirection":"higher"}
{"run":1,"commit":"868c362","metric":0,"metrics":{},"status":"crash","description":"baseline: reproduce invalid flow-nexus cached array schemas missing items for Codex/OpenAI Responses","timestamp":1773548946883,"segment":0}
{"run":2,"commit":"868c362","metric":0,"metrics":{},"status":"crash","description":"add strict array-items normalization plus targeted tests and install updated forge binary","timestamp":1773549061827,"segment":0}
{"run":3,"commit":"868c362","metric":0,"metrics":{},"status":"crash","description":"narrow verification to forge_repo targeted test plus binary install; hit unrelated existing test fixture breakage","timestamp":1773549131352,"segment":0}
{"run":4,"commit":"efe3cb4","metric":1,"metrics":{},"status":"keep","description":"normalize missing array items in strict MCP schemas and patch invalid flow-nexus cache entries","timestamp":1773549295371,"segment":0}
{"type":"config","name":"Harden MCP cache reads and OpenAI tool schema normalization","metricName":"repro_success","metricUnit":"","bestDirection":"higher"}
{"run":1,"commit":"efe3cb4","metric":0,"metrics":{},"status":"crash","description":"baseline: exact cognee-tools prompt still fails on invalid jina uri format in cached MCP schema","timestamp":1773549536604,"segment":0}
{"run":2,"commit":"efe3cb4","metric":0,"metrics":{},"status":"crash","description":"build hardened forge and corrupt jina MCP cache entry; prompt still emitted an error in runtime output","timestamp":1773549760868,"segment":0}
{"run":3,"commit":"efe3cb4","metric":0,"metrics":{},"status":"crash","description":"remove forge and reinstall fish integration with current binary; fresh install failed because no default provider was configured","timestamp":1773549910490,"segment":0}
{"run":4,"commit":"bbf9b25","metric":1,"metrics":{},"status":"keep","description":"stop fish colon dispatch from echoing typed prompt so : prompt and :command do not visually repeat","timestamp":1773550572070,"segment":0}
{"run":5,"commit":"bbf9b25","metric":1,"metrics":{},"status":"discard","description":"verify current default Codex provider can answer `what is vellum`; direct forge prompt succeeds so failure is not a stable baseline repro","timestamp":1773551242766,"segment":0}
{"type":"config","name":"Remove flow-nexus MCP traces from user config and cache","metricName":"flow_nexus_artifacts","metricUnit":"","bestDirection":"lower"}
{"run":1,"commit":"bb92007","metric":2,"metrics":{},"status":"keep","description":"baseline: count remaining flow-nexus traces in user MCP config and forge MCP cache","timestamp":1773551343704,"segment":0}
{"run":2,"commit":"4dfd97c","metric":0,"metrics":{},"status":"keep","description":"remove flow-nexus from user MCP config and delete cached forge flow-nexus tool schema artifact","timestamp":1773551389509,"segment":0}
{"run":3,"commit":"4dfd97c","metric":0,"metrics":{},"status":"discard","description":"verify `forge -p \"what is vellum\" --verbose` no longer hits any flow-nexus schema error after removing flow-nexus from user MCP config and cache","timestamp":1773551488322,"segment":0}
